2025-08-23 23:32:19 - 🔄 Starting robust batch processing...
2025-08-23 23:32:19 - 📊 Batch size: 100
2025-08-23 23:32:19 - ---
2025-08-23 23:32:19 - 📊 Processing first 100 branches out of total cursor branches
2025-08-23 23:32:19 - ---
2025-08-23 23:32:19 - 📋 Processing branch 1/100: cursor/add-2030q1-services-ui-8deb1aee36d
2025-08-23 23:32:20 - 🔄 Attempting to merge cursor/add-2030q1-services-ui-8deb1aee36d (attempt 1/3)...
2025-08-23 23:32:20 - 🔄 Syncing with remote main branch...
2025-08-23 23:32:22 - ✅ Synced with remote main branch
2025-08-23 23:32:23 - ✅ Successfully merged cursor/add-2030q1-services-ui-8deb1aee36d
2025-08-23 23:32:23 - ✅ Branch cursor/add-2030q1-services-ui-8deb1aee36d processed successfully
2025-08-23 23:32:23 - 📊 Progress: 1 successful, 0 failed, 0 conflicts resolved
2025-08-23 23:32:23 - ---
2025-08-23 23:32:23 - 📋 Processing branch 2/100: cursor/add-and-advertise-new-services-then-build-0357
2025-08-23 23:32:23 - 🔄 Attempting to merge cursor/add-and-advertise-new-services-then-build-0357 (attempt 1/3)...
2025-08-23 23:32:23 - 🔄 Syncing with remote main branch...
2025-08-23 23:32:24 - ✅ Synced with remote main branch
2025-08-23 23:32:24 - ✅ Successfully merged cursor/add-and-advertise-new-services-then-build-0357
2025-08-23 23:32:25 - ✅ Branch cursor/add-and-advertise-new-services-then-build-0357 processed successfully
2025-08-23 23:32:25 - 📊 Progress: 2 successful, 0 failed, 0 conflicts resolved
2025-08-23 23:32:25 - ---
2025-08-23 23:32:25 - 📋 Processing branch 3/100: cursor/add-and-advertise-new-services-then-build-03b6
2025-08-23 23:32:25 - 🔄 Attempting to merge cursor/add-and-advertise-new-services-then-build-03b6 (attempt 1/3)...
2025-08-23 23:32:25 - 🔄 Syncing with remote main branch...
2025-08-23 23:32:26 - ✅ Synced with remote main branch
2025-08-23 23:32:26 - ✅ Successfully merged cursor/add-and-advertise-new-services-then-build-03b6
2025-08-23 23:32:26 - ✅ Branch cursor/add-and-advertise-new-services-then-build-03b6 processed successfully
2025-08-23 23:32:26 - 📊 Progress: 3 successful, 0 failed, 0 conflicts resolved
2025-08-23 23:32:26 - ---
2025-08-23 23:32:26 - 📋 Processing branch 4/100: cursor/add-and-advertise-new-services-then-build-06aa
2025-08-23 23:32:27 - 🔄 Attempting to merge cursor/add-and-advertise-new-services-then-build-06aa (attempt 1/3)...
2025-08-23 23:32:27 - 🔄 Syncing with remote main branch...
2025-08-23 23:32:28 - ✅ Synced with remote main branch
2025-08-23 23:32:28 - ✅ Successfully merged cursor/add-and-advertise-new-services-then-build-06aa
2025-08-23 23:32:28 - ✅ Branch cursor/add-and-advertise-new-services-then-build-06aa processed successfully
2025-08-23 23:32:28 - 📊 Progress: 4 successful, 0 failed, 0 conflicts resolved
2025-08-23 23:32:28 - ---
2025-08-23 23:32:28 - 📋 Processing branch 5/100: cursor/add-and-advertise-new-services-then-build-0756
2025-08-23 23:32:29 - 🔄 Attempting to merge cursor/add-and-advertise-new-services-then-build-0756 (attempt 1/3)...
2025-08-23 23:32:29 - 🔄 Syncing with remote main branch...
2025-08-23 23:32:29 - ✅ Synced with remote main branch
2025-08-23 23:32:30 - ✅ Successfully merged cursor/add-and-advertise-new-services-then-build-0756
2025-08-23 23:32:30 - ✅ Branch cursor/add-and-advertise-new-services-then-build-0756 processed successfully
2025-08-23 23:32:30 - 📊 Progress: 5 successful, 0 failed, 0 conflicts resolved
2025-08-23 23:32:30 - ---
2025-08-23 23:32:30 - 📋 Processing branch 6/100: cursor/add-and-advertise-new-services-then-build-0c04
2025-08-23 23:32:30 - 🔄 Attempting to merge cursor/add-and-advertise-new-services-then-build-0c04 (attempt 1/3)...
2025-08-23 23:32:30 - 🔄 Syncing with remote main branch...
2025-08-23 23:32:31 - ✅ Synced with remote main branch
2025-08-23 23:32:32 - ✅ Successfully merged cursor/add-and-advertise-new-services-then-build-0c04
2025-08-23 23:32:32 - ✅ Branch cursor/add-and-advertise-new-services-then-build-0c04 processed successfully
2025-08-23 23:32:32 - 📊 Progress: 6 successful, 0 failed, 0 conflicts resolved
2025-08-23 23:32:32 - ---
2025-08-23 23:32:32 - 📋 Processing branch 7/100: cursor/add-and-advertise-new-services-then-build-0cca
2025-08-23 23:32:32 - 🔄 Attempting to merge cursor/add-and-advertise-new-services-then-build-0cca (attempt 1/3)...
2025-08-23 23:32:32 - 🔄 Syncing with remote main branch...
2025-08-23 23:32:33 - ✅ Synced with remote main branch
2025-08-23 23:32:33 - ✅ Successfully merged cursor/add-and-advertise-new-services-then-build-0cca
2025-08-23 23:32:34 - ✅ Branch cursor/add-and-advertise-new-services-then-build-0cca processed successfully
2025-08-23 23:32:34 - 📊 Progress: 7 successful, 0 failed, 0 conflicts resolved
2025-08-23 23:32:34 - ---
2025-08-23 23:32:34 - 📋 Processing branch 8/100: cursor/add-and-advertise-new-services-then-build-174e
2025-08-23 23:32:34 - 🔄 Attempting to merge cursor/add-and-advertise-new-services-then-build-174e (attempt 1/3)...
2025-08-23 23:32:34 - 🔄 Syncing with remote main branch...
2025-08-23 23:32:35 - ✅ Synced with remote main branch
2025-08-23 23:32:35 - ✅ Successfully merged cursor/add-and-advertise-new-services-then-build-174e
2025-08-23 23:32:35 - ✅ Branch cursor/add-and-advertise-new-services-then-build-174e processed successfully
2025-08-23 23:32:35 - 📊 Progress: 8 successful, 0 failed, 0 conflicts resolved
2025-08-23 23:32:35 - ---
2025-08-23 23:32:35 - 📋 Processing branch 9/100: cursor/add-and-advertise-new-services-then-build-17cc
2025-08-23 23:32:36 - 🔄 Attempting to merge cursor/add-and-advertise-new-services-then-build-17cc (attempt 1/3)...
2025-08-23 23:32:36 - 🔄 Syncing with remote main branch...
2025-08-23 23:32:36 - ✅ Synced with remote main branch
2025-08-23 23:32:37 - ✅ Successfully merged cursor/add-and-advertise-new-services-then-build-17cc
2025-08-23 23:32:37 - ✅ Branch cursor/add-and-advertise-new-services-then-build-17cc processed successfully
2025-08-23 23:32:37 - 📊 Progress: 9 successful, 0 failed, 0 conflicts resolved
2025-08-23 23:32:37 - ---
2025-08-23 23:32:37 - 📋 Processing branch 10/100: cursor/add-and-advertise-new-services-then-build-192f
2025-08-23 23:32:37 - 🔄 Attempting to merge cursor/add-and-advertise-new-services-then-build-192f (attempt 1/3)...
2025-08-23 23:32:37 - 🔄 Syncing with remote main branch...
2025-08-23 23:32:38 - ✅ Synced with remote main branch
2025-08-23 23:32:38 - ✅ Successfully merged cursor/add-and-advertise-new-services-then-build-192f
2025-08-23 23:32:38 - ✅ Branch cursor/add-and-advertise-new-services-then-build-192f processed successfully
2025-08-23 23:32:38 - 📊 Progress: 10 successful, 0 failed, 0 conflicts resolved
2025-08-23 23:32:39 - ---
2025-08-23 23:32:39 - 📋 Processing branch 11/100: cursor/add-and-advertise-new-services-then-build-1d5b
2025-08-23 23:32:39 - 🔄 Attempting to merge cursor/add-and-advertise-new-services-then-build-1d5b (attempt 1/3)...
2025-08-23 23:32:39 - 🔄 Syncing with remote main branch...
2025-08-23 23:32:39 - ✅ Synced with remote main branch
2025-08-23 23:32:40 - ✅ Successfully merged cursor/add-and-advertise-new-services-then-build-1d5b
2025-08-23 23:32:40 - ✅ Branch cursor/add-and-advertise-new-services-then-build-1d5b processed successfully
2025-08-23 23:32:40 - 📊 Progress: 11 successful, 0 failed, 0 conflicts resolved
2025-08-23 23:32:40 - ---
2025-08-23 23:32:40 - 📋 Processing branch 12/100: cursor/add-and-advertise-new-services-then-build-21f8
2025-08-23 23:32:40 - 🔄 Attempting to merge cursor/add-and-advertise-new-services-then-build-21f8 (attempt 1/3)...
2025-08-23 23:32:40 - 🔄 Syncing with remote main branch...
2025-08-23 23:32:41 - ✅ Synced with remote main branch
2025-08-23 23:32:42 - ✅ Successfully merged cursor/add-and-advertise-new-services-then-build-21f8
2025-08-23 23:32:42 - ✅ Branch cursor/add-and-advertise-new-services-then-build-21f8 processed successfully
2025-08-23 23:32:42 - 📊 Progress: 12 successful, 0 failed, 0 conflicts resolved
2025-08-23 23:32:42 - ---
2025-08-23 23:32:42 - 📋 Processing branch 13/100: cursor/add-and-advertise-new-services-then-build-2b91
2025-08-23 23:32:42 - 🔄 Attempting to merge cursor/add-and-advertise-new-services-then-build-2b91 (attempt 1/3)...
2025-08-23 23:32:42 - 🔄 Syncing with remote main branch...
2025-08-23 23:32:43 - ✅ Synced with remote main branch
2025-08-23 23:32:43 - ✅ Successfully merged cursor/add-and-advertise-new-services-then-build-2b91
2025-08-23 23:32:43 - ✅ Branch cursor/add-and-advertise-new-services-then-build-2b91 processed successfully
2025-08-23 23:32:43 - 📊 Progress: 13 successful, 0 failed, 0 conflicts resolved
2025-08-23 23:32:43 - ---
2025-08-23 23:32:43 - 📋 Processing branch 14/100: cursor/add-and-advertise-new-services-then-build-2c85
2025-08-23 23:32:44 - 🔄 Attempting to merge cursor/add-and-advertise-new-services-then-build-2c85 (attempt 1/3)...
2025-08-23 23:32:44 - 🔄 Syncing with remote main branch...
2025-08-23 23:32:44 - ✅ Synced with remote main branch
2025-08-23 23:32:45 - ✅ Successfully merged cursor/add-and-advertise-new-services-then-build-2c85
2025-08-23 23:32:45 - ✅ Branch cursor/add-and-advertise-new-services-then-build-2c85 processed successfully
2025-08-23 23:32:45 - 📊 Progress: 14 successful, 0 failed, 0 conflicts resolved
2025-08-23 23:32:45 - ---
2025-08-23 23:32:45 - 📋 Processing branch 15/100: cursor/add-and-advertise-new-services-then-build-336c
2025-08-23 23:32:45 - 🔄 Attempting to merge cursor/add-and-advertise-new-services-then-build-336c (attempt 1/3)...
2025-08-23 23:32:45 - 🔄 Syncing with remote main branch...
2025-08-23 23:32:46 - ✅ Synced with remote main branch
2025-08-23 23:32:47 - ✅ Successfully merged cursor/add-and-advertise-new-services-then-build-336c
2025-08-23 23:32:47 - ✅ Branch cursor/add-and-advertise-new-services-then-build-336c processed successfully
2025-08-23 23:32:47 - 📊 Progress: 15 successful, 0 failed, 0 conflicts resolved
2025-08-23 23:32:47 - ---
2025-08-23 23:32:47 - 📋 Processing branch 16/100: cursor/add-and-advertise-new-services-then-build-359a
2025-08-23 23:32:47 - 🔄 Attempting to merge cursor/add-and-advertise-new-services-then-build-359a (attempt 1/3)...
2025-08-23 23:32:47 - 🔄 Syncing with remote main branch...
2025-08-23 23:32:48 - ✅ Synced with remote main branch
2025-08-23 23:32:48 - ✅ Successfully merged cursor/add-and-advertise-new-services-then-build-359a
2025-08-23 23:32:49 - ✅ Branch cursor/add-and-advertise-new-services-then-build-359a processed successfully
2025-08-23 23:32:49 - 📊 Progress: 16 successful, 0 failed, 0 conflicts resolved
2025-08-23 23:32:49 - ---
2025-08-23 23:32:49 - 📋 Processing branch 17/100: cursor/add-and-advertise-new-services-then-build-39d5
2025-08-23 23:32:49 - 🔄 Attempting to merge cursor/add-and-advertise-new-services-then-build-39d5 (attempt 1/3)...
2025-08-23 23:32:49 - 🔄 Syncing with remote main branch...
2025-08-23 23:32:50 - ✅ Synced with remote main branch
2025-08-23 23:32:50 - ✅ Successfully merged cursor/add-and-advertise-new-services-then-build-39d5
2025-08-23 23:32:50 - ✅ Branch cursor/add-and-advertise-new-services-then-build-39d5 processed successfully
2025-08-23 23:32:50 - 📊 Progress: 17 successful, 0 failed, 0 conflicts resolved
2025-08-23 23:32:50 - ---
2025-08-23 23:32:50 - 📋 Processing branch 18/100: cursor/add-and-advertise-new-services-then-build-3ac9
2025-08-23 23:32:51 - 🔄 Attempting to merge cursor/add-and-advertise-new-services-then-build-3ac9 (attempt 1/3)...
2025-08-23 23:32:51 - 🔄 Syncing with remote main branch...
2025-08-23 23:32:51 - ✅ Synced with remote main branch
2025-08-23 23:32:52 - ✅ Successfully merged cursor/add-and-advertise-new-services-then-build-3ac9
2025-08-23 23:32:52 - ✅ Branch cursor/add-and-advertise-new-services-then-build-3ac9 processed successfully
2025-08-23 23:32:52 - 📊 Progress: 18 successful, 0 failed, 0 conflicts resolved
2025-08-23 23:32:52 - ---
2025-08-23 23:32:52 - 📋 Processing branch 19/100: cursor/add-and-advertise-new-services-then-build-3bf4
2025-08-23 23:32:52 - 🔄 Attempting to merge cursor/add-and-advertise-new-services-then-build-3bf4 (attempt 1/3)...
2025-08-23 23:32:52 - 🔄 Syncing with remote main branch...
2025-08-23 23:32:53 - ✅ Synced with remote main branch
2025-08-23 23:32:53 - ✅ Successfully merged cursor/add-and-advertise-new-services-then-build-3bf4
2025-08-23 23:32:54 - ✅ Branch cursor/add-and-advertise-new-services-then-build-3bf4 processed successfully
2025-08-23 23:32:54 - 📊 Progress: 19 successful, 0 failed, 0 conflicts resolved
2025-08-23 23:32:54 - ---
2025-08-23 23:32:54 - 📋 Processing branch 20/100: cursor/add-and-advertise-new-services-then-build-3f02
2025-08-23 23:32:54 - 🔄 Attempting to merge cursor/add-and-advertise-new-services-then-build-3f02 (attempt 1/3)...
2025-08-23 23:32:54 - 🔄 Syncing with remote main branch...
2025-08-23 23:32:55 - ✅ Synced with remote main branch
2025-08-23 23:32:56 - ✅ Successfully merged cursor/add-and-advertise-new-services-then-build-3f02
2025-08-23 23:32:56 - ✅ Branch cursor/add-and-advertise-new-services-then-build-3f02 processed successfully
2025-08-23 23:32:56 - 📊 Progress: 20 successful, 0 failed, 0 conflicts resolved
2025-08-23 23:32:56 - ---
2025-08-23 23:32:56 - 📋 Processing branch 21/100: cursor/add-and-advertise-new-services-then-build-3f57
2025-08-23 23:32:56 - 🔄 Attempting to merge cursor/add-and-advertise-new-services-then-build-3f57 (attempt 1/3)...
2025-08-23 23:32:56 - 🔄 Syncing with remote main branch...
2025-08-23 23:32:57 - ✅ Synced with remote main branch
2025-08-23 23:32:58 - ✅ Successfully merged cursor/add-and-advertise-new-services-then-build-3f57
2025-08-23 23:32:58 - ✅ Branch cursor/add-and-advertise-new-services-then-build-3f57 processed successfully
2025-08-23 23:32:58 - 📊 Progress: 21 successful, 0 failed, 0 conflicts resolved
2025-08-23 23:32:58 - ---
2025-08-23 23:32:58 - 📋 Processing branch 22/100: cursor/add-and-advertise-new-services-then-build-4074
2025-08-23 23:32:58 - 🔄 Attempting to merge cursor/add-and-advertise-new-services-then-build-4074 (attempt 1/3)...
2025-08-23 23:32:58 - 🔄 Syncing with remote main branch...
2025-08-23 23:32:59 - ✅ Synced with remote main branch
2025-08-23 23:32:59 - ✅ Successfully merged cursor/add-and-advertise-new-services-then-build-4074
2025-08-23 23:32:59 - ✅ Branch cursor/add-and-advertise-new-services-then-build-4074 processed successfully
2025-08-23 23:32:59 - 📊 Progress: 22 successful, 0 failed, 0 conflicts resolved
2025-08-23 23:32:59 - ---
2025-08-23 23:32:59 - 📋 Processing branch 23/100: cursor/add-and-advertise-new-services-then-build-4798
2025-08-23 23:33:00 - 🔄 Attempting to merge cursor/add-and-advertise-new-services-then-build-4798 (attempt 1/3)...
2025-08-23 23:33:00 - 🔄 Syncing with remote main branch...
2025-08-23 23:33:00 - ✅ Synced with remote main branch
2025-08-23 23:33:01 - ✅ Successfully merged cursor/add-and-advertise-new-services-then-build-4798
2025-08-23 23:33:01 - ✅ Branch cursor/add-and-advertise-new-services-then-build-4798 processed successfully
2025-08-23 23:33:01 - 📊 Progress: 23 successful, 0 failed, 0 conflicts resolved
2025-08-23 23:33:01 - ---
2025-08-23 23:33:01 - 📋 Processing branch 24/100: cursor/add-and-advertise-new-services-then-build-4941
2025-08-23 23:33:01 - 🔄 Attempting to merge cursor/add-and-advertise-new-services-then-build-4941 (attempt 1/3)...
2025-08-23 23:33:01 - 🔄 Syncing with remote main branch...
2025-08-23 23:33:02 - ✅ Synced with remote main branch
2025-08-23 23:33:02 - ✅ Successfully merged cursor/add-and-advertise-new-services-then-build-4941
2025-08-23 23:33:03 - ✅ Branch cursor/add-and-advertise-new-services-then-build-4941 processed successfully
2025-08-23 23:33:03 - 📊 Progress: 24 successful, 0 failed, 0 conflicts resolved
2025-08-23 23:33:03 - ---
2025-08-23 23:33:03 - 📋 Processing branch 25/100: cursor/add-and-advertise-new-services-then-build-49c1
2025-08-23 23:33:03 - 🔄 Attempting to merge cursor/add-and-advertise-new-services-then-build-49c1 (attempt 1/3)...
2025-08-23 23:33:03 - 🔄 Syncing with remote main branch...
2025-08-23 23:33:04 - ✅ Synced with remote main branch
2025-08-23 23:33:04 - ✅ Successfully merged cursor/add-and-advertise-new-services-then-build-49c1
2025-08-23 23:33:04 - ✅ Branch cursor/add-and-advertise-new-services-then-build-49c1 processed successfully
2025-08-23 23:33:04 - 📊 Progress: 25 successful, 0 failed, 0 conflicts resolved
2025-08-23 23:33:04 - ---
2025-08-23 23:33:04 - 💾 Pushing intermediate changes to remote...
2025-08-23 23:33:05 - ✅ Successfully pushed changes to remote
2025-08-23 23:33:05 - 📋 Processing branch 26/100: cursor/add-and-advertise-new-services-then-build-4e03
2025-08-23 23:33:05 - 🔄 Attempting to merge cursor/add-and-advertise-new-services-then-build-4e03 (attempt 1/3)...
2025-08-23 23:33:05 - 🔄 Syncing with remote main branch...
2025-08-23 23:33:06 - ✅ Synced with remote main branch
2025-08-23 23:33:06 - ✅ Successfully merged cursor/add-and-advertise-new-services-then-build-4e03
2025-08-23 23:33:06 - ✅ Branch cursor/add-and-advertise-new-services-then-build-4e03 processed successfully
2025-08-23 23:33:06 - 📊 Progress: 26 successful, 0 failed, 0 conflicts resolved
2025-08-23 23:33:06 - ---
2025-08-23 23:33:06 - 📋 Processing branch 27/100: cursor/add-and-advertise-new-services-then-build-5035
2025-08-23 23:33:07 - 🔄 Attempting to merge cursor/add-and-advertise-new-services-then-build-5035 (attempt 1/3)...
2025-08-23 23:33:07 - 🔄 Syncing with remote main branch...
2025-08-23 23:33:07 - ✅ Synced with remote main branch
2025-08-23 23:33:08 - ✅ Successfully merged cursor/add-and-advertise-new-services-then-build-5035
2025-08-23 23:33:08 - ✅ Branch cursor/add-and-advertise-new-services-then-build-5035 processed successfully
2025-08-23 23:33:08 - 📊 Progress: 27 successful, 0 failed, 0 conflicts resolved
2025-08-23 23:33:08 - ---
2025-08-23 23:33:08 - 📋 Processing branch 28/100: cursor/add-and-advertise-new-services-then-build-506a
2025-08-23 23:33:08 - 🔄 Attempting to merge cursor/add-and-advertise-new-services-then-build-506a (attempt 1/3)...
2025-08-23 23:33:08 - 🔄 Syncing with remote main branch...
2025-08-23 23:33:09 - ✅ Synced with remote main branch
2025-08-23 23:33:09 - ✅ Successfully merged cursor/add-and-advertise-new-services-then-build-506a
2025-08-23 23:33:10 - ✅ Branch cursor/add-and-advertise-new-services-then-build-506a processed successfully
2025-08-23 23:33:10 - 📊 Progress: 28 successful, 0 failed, 0 conflicts resolved
2025-08-23 23:33:10 - ---
2025-08-23 23:33:10 - 📋 Processing branch 29/100: cursor/add-and-advertise-new-services-then-build-5511
2025-08-23 23:33:10 - 🔄 Attempting to merge cursor/add-and-advertise-new-services-then-build-5511 (attempt 1/3)...
2025-08-23 23:33:10 - 🔄 Syncing with remote main branch...
2025-08-23 23:33:11 - ✅ Synced with remote main branch
2025-08-23 23:33:11 - ✅ Successfully merged cursor/add-and-advertise-new-services-then-build-5511
2025-08-23 23:33:11 - ✅ Branch cursor/add-and-advertise-new-services-then-build-5511 processed successfully
2025-08-23 23:33:11 - 📊 Progress: 29 successful, 0 failed, 0 conflicts resolved
2025-08-23 23:33:11 - ---
2025-08-23 23:33:11 - 📋 Processing branch 30/100: cursor/add-and-advertise-new-services-then-build-5a0b
2025-08-23 23:33:12 - 🔄 Attempting to merge cursor/add-and-advertise-new-services-then-build-5a0b (attempt 1/3)...
2025-08-23 23:33:12 - 🔄 Syncing with remote main branch...
2025-08-23 23:33:12 - ✅ Synced with remote main branch
2025-08-23 23:33:13 - ✅ Successfully merged cursor/add-and-advertise-new-services-then-build-5a0b
2025-08-23 23:33:13 - ✅ Branch cursor/add-and-advertise-new-services-then-build-5a0b processed successfully
2025-08-23 23:33:13 - 📊 Progress: 30 successful, 0 failed, 0 conflicts resolved
2025-08-23 23:33:13 - ---
2025-08-23 23:33:13 - 📋 Processing branch 31/100: cursor/add-and-advertise-new-services-then-build-5b39
2025-08-23 23:33:13 - 🔄 Attempting to merge cursor/add-and-advertise-new-services-then-build-5b39 (attempt 1/3)...
2025-08-23 23:33:13 - 🔄 Syncing with remote main branch...
2025-08-23 23:33:14 - ✅ Synced with remote main branch
2025-08-23 23:33:14 - ✅ Successfully merged cursor/add-and-advertise-new-services-then-build-5b39
2025-08-23 23:33:14 - ✅ Branch cursor/add-and-advertise-new-services-then-build-5b39 processed successfully
2025-08-23 23:33:14 - 📊 Progress: 31 successful, 0 failed, 0 conflicts resolved
2025-08-23 23:33:14 - ---
2025-08-23 23:33:14 - 📋 Processing branch 32/100: cursor/add-and-advertise-new-services-then-build-6510
2025-08-23 23:33:15 - 🔄 Attempting to merge cursor/add-and-advertise-new-services-then-build-6510 (attempt 1/3)...
2025-08-23 23:33:15 - 🔄 Syncing with remote main branch...
2025-08-23 23:33:15 - ✅ Synced with remote main branch
2025-08-23 23:33:16 - ✅ Successfully merged cursor/add-and-advertise-new-services-then-build-6510
2025-08-23 23:33:16 - ✅ Branch cursor/add-and-advertise-new-services-then-build-6510 processed successfully
2025-08-23 23:33:16 - 📊 Progress: 32 successful, 0 failed, 0 conflicts resolved
2025-08-23 23:33:16 - ---
2025-08-23 23:33:16 - 📋 Processing branch 33/100: cursor/add-and-advertise-new-services-then-build-6afb
2025-08-23 23:33:16 - 🔄 Attempting to merge cursor/add-and-advertise-new-services-then-build-6afb (attempt 1/3)...
2025-08-23 23:33:16 - 🔄 Syncing with remote main branch...
2025-08-23 23:33:17 - ✅ Synced with remote main branch
2025-08-23 23:33:18 - ✅ Successfully merged cursor/add-and-advertise-new-services-then-build-6afb
2025-08-23 23:33:18 - ✅ Branch cursor/add-and-advertise-new-services-then-build-6afb processed successfully
2025-08-23 23:33:18 - 📊 Progress: 33 successful, 0 failed, 0 conflicts resolved
2025-08-23 23:33:18 - ---
2025-08-23 23:33:18 - 📋 Processing branch 34/100: cursor/add-and-advertise-new-services-then-build-6d14
2025-08-23 23:33:18 - 🔄 Attempting to merge cursor/add-and-advertise-new-services-then-build-6d14 (attempt 1/3)...
2025-08-23 23:33:18 - 🔄 Syncing with remote main branch...
2025-08-23 23:33:19 - ✅ Synced with remote main branch
2025-08-23 23:33:19 - ✅ Successfully merged cursor/add-and-advertise-new-services-then-build-6d14
2025-08-23 23:33:20 - ✅ Branch cursor/add-and-advertise-new-services-then-build-6d14 processed successfully
2025-08-23 23:33:20 - 📊 Progress: 34 successful, 0 failed, 0 conflicts resolved
2025-08-23 23:33:20 - ---
2025-08-23 23:33:20 - 📋 Processing branch 35/100: cursor/add-and-advertise-new-services-then-build-7152
2025-08-23 23:33:20 - 🔄 Attempting to merge cursor/add-and-advertise-new-services-then-build-7152 (attempt 1/3)...
2025-08-23 23:33:20 - 🔄 Syncing with remote main branch...
2025-08-23 23:33:21 - ✅ Synced with remote main branch
2025-08-23 23:33:21 - ✅ Successfully merged cursor/add-and-advertise-new-services-then-build-7152
2025-08-23 23:33:21 - ✅ Branch cursor/add-and-advertise-new-services-then-build-7152 processed successfully
2025-08-23 23:33:21 - 📊 Progress: 35 successful, 0 failed, 0 conflicts resolved
2025-08-23 23:33:21 - ---
2025-08-23 23:33:21 - 📋 Processing branch 36/100: cursor/add-and-advertise-new-services-then-build-7683
2025-08-23 23:33:22 - 🔄 Attempting to merge cursor/add-and-advertise-new-services-then-build-7683 (attempt 1/3)...
2025-08-23 23:33:22 - 🔄 Syncing with remote main branch...
2025-08-23 23:33:22 - ✅ Synced with remote main branch
2025-08-23 23:33:23 - ✅ Successfully merged cursor/add-and-advertise-new-services-then-build-7683
2025-08-23 23:33:23 - ✅ Branch cursor/add-and-advertise-new-services-then-build-7683 processed successfully
2025-08-23 23:33:23 - 📊 Progress: 36 successful, 0 failed, 0 conflicts resolved
2025-08-23 23:33:23 - ---
2025-08-23 23:33:23 - 📋 Processing branch 37/100: cursor/add-and-advertise-new-services-then-build-7aec
2025-08-23 23:33:23 - 🔄 Attempting to merge cursor/add-and-advertise-new-services-then-build-7aec (attempt 1/3)...
2025-08-23 23:33:23 - 🔄 Syncing with remote main branch...
2025-08-23 23:33:24 - ✅ Synced with remote main branch
2025-08-23 23:33:24 - ✅ Successfully merged cursor/add-and-advertise-new-services-then-build-7aec
2025-08-23 23:33:25 - ✅ Branch cursor/add-and-advertise-new-services-then-build-7aec processed successfully
2025-08-23 23:33:25 - 📊 Progress: 37 successful, 0 failed, 0 conflicts resolved
2025-08-23 23:33:25 - ---
2025-08-23 23:33:25 - 📋 Processing branch 38/100: cursor/add-and-advertise-new-services-then-build-7c2e
2025-08-23 23:33:25 - 🔄 Attempting to merge cursor/add-and-advertise-new-services-then-build-7c2e (attempt 1/3)...
2025-08-23 23:33:25 - 🔄 Syncing with remote main branch...
2025-08-23 23:33:26 - ✅ Synced with remote main branch
2025-08-23 23:33:26 - ✅ Successfully merged cursor/add-and-advertise-new-services-then-build-7c2e
2025-08-23 23:33:26 - ✅ Branch cursor/add-and-advertise-new-services-then-build-7c2e processed successfully
2025-08-23 23:33:26 - 📊 Progress: 38 successful, 0 failed, 0 conflicts resolved
2025-08-23 23:33:26 - ---
2025-08-23 23:33:26 - 📋 Processing branch 39/100: cursor/add-and-advertise-new-services-then-build-7fe9
2025-08-23 23:33:27 - 🔄 Attempting to merge cursor/add-and-advertise-new-services-then-build-7fe9 (attempt 1/3)...
2025-08-23 23:33:27 - 🔄 Syncing with remote main branch...
2025-08-23 23:33:27 - ✅ Synced with remote main branch
2025-08-23 23:33:28 - ✅ Successfully merged cursor/add-and-advertise-new-services-then-build-7fe9
2025-08-23 23:33:28 - ✅ Branch cursor/add-and-advertise-new-services-then-build-7fe9 processed successfully
2025-08-23 23:33:28 - 📊 Progress: 39 successful, 0 failed, 0 conflicts resolved
2025-08-23 23:33:28 - ---
2025-08-23 23:33:28 - 📋 Processing branch 40/100: cursor/add-and-advertise-new-services-then-build-8699
2025-08-23 23:33:28 - 🔄 Attempting to merge cursor/add-and-advertise-new-services-then-build-8699 (attempt 1/3)...
2025-08-23 23:33:28 - 🔄 Syncing with remote main branch...
2025-08-23 23:33:29 - ✅ Synced with remote main branch
2025-08-23 23:33:29 - ✅ Successfully merged cursor/add-and-advertise-new-services-then-build-8699
2025-08-23 23:33:29 - ✅ Branch cursor/add-and-advertise-new-services-then-build-8699 processed successfully
2025-08-23 23:33:29 - 📊 Progress: 40 successful, 0 failed, 0 conflicts resolved
2025-08-23 23:33:29 - ---
2025-08-23 23:33:29 - 📋 Processing branch 41/100: cursor/add-and-advertise-new-services-then-build-86e9
2025-08-23 23:33:30 - 🔄 Attempting to merge cursor/add-and-advertise-new-services-then-build-86e9 (attempt 1/3)...
2025-08-23 23:33:30 - 🔄 Syncing with remote main branch...
2025-08-23 23:33:30 - ✅ Synced with remote main branch
2025-08-23 23:33:31 - ✅ Successfully merged cursor/add-and-advertise-new-services-then-build-86e9
2025-08-23 23:33:31 - ✅ Branch cursor/add-and-advertise-new-services-then-build-86e9 processed successfully
2025-08-23 23:33:31 - 📊 Progress: 41 successful, 0 failed, 0 conflicts resolved
2025-08-23 23:33:31 - ---
2025-08-23 23:33:31 - 📋 Processing branch 42/100: cursor/add-and-advertise-new-services-then-build-8c77
2025-08-23 23:33:31 - 🔄 Attempting to merge cursor/add-and-advertise-new-services-then-build-8c77 (attempt 1/3)...
2025-08-23 23:33:31 - 🔄 Syncing with remote main branch...
2025-08-23 23:33:32 - ✅ Synced with remote main branch
2025-08-23 23:33:32 - ✅ Successfully merged cursor/add-and-advertise-new-services-then-build-8c77
2025-08-23 23:33:33 - ✅ Branch cursor/add-and-advertise-new-services-then-build-8c77 processed successfully
2025-08-23 23:33:33 - 📊 Progress: 42 successful, 0 failed, 0 conflicts resolved
2025-08-23 23:33:33 - ---
2025-08-23 23:33:33 - 📋 Processing branch 43/100: cursor/add-and-advertise-new-services-then-build-98f2
2025-08-23 23:33:33 - 🔄 Attempting to merge cursor/add-and-advertise-new-services-then-build-98f2 (attempt 1/3)...
2025-08-23 23:33:33 - 🔄 Syncing with remote main branch...
2025-08-23 23:33:34 - ✅ Synced with remote main branch
2025-08-23 23:33:34 - ✅ Successfully merged cursor/add-and-advertise-new-services-then-build-98f2
2025-08-23 23:33:34 - ✅ Branch cursor/add-and-advertise-new-services-then-build-98f2 processed successfully
2025-08-23 23:33:34 - 📊 Progress: 43 successful, 0 failed, 0 conflicts resolved
2025-08-23 23:33:34 - ---
2025-08-23 23:33:34 - 📋 Processing branch 44/100: cursor/add-and-advertise-new-services-then-build-99f7
2025-08-23 23:33:35 - 🔄 Attempting to merge cursor/add-and-advertise-new-services-then-build-99f7 (attempt 1/3)...
2025-08-23 23:33:35 - 🔄 Syncing with remote main branch...
2025-08-23 23:33:35 - ✅ Synced with remote main branch
2025-08-23 23:33:36 - ✅ Successfully merged cursor/add-and-advertise-new-services-then-build-99f7
2025-08-23 23:33:36 - ✅ Branch cursor/add-and-advertise-new-services-then-build-99f7 processed successfully
2025-08-23 23:33:36 - 📊 Progress: 44 successful, 0 failed, 0 conflicts resolved
2025-08-23 23:33:36 - ---
2025-08-23 23:33:36 - 📋 Processing branch 45/100: cursor/add-and-advertise-new-services-then-build-9c6d
2025-08-23 23:33:36 - 🔄 Attempting to merge cursor/add-and-advertise-new-services-then-build-9c6d (attempt 1/3)...
2025-08-23 23:33:36 - 🔄 Syncing with remote main branch...
2025-08-23 23:33:37 - ✅ Synced with remote main branch
2025-08-23 23:33:37 - ✅ Successfully merged cursor/add-and-advertise-new-services-then-build-9c6d
2025-08-23 23:33:38 - ✅ Branch cursor/add-and-advertise-new-services-then-build-9c6d processed successfully
2025-08-23 23:33:38 - 📊 Progress: 45 successful, 0 failed, 0 conflicts resolved
2025-08-23 23:33:38 - ---
2025-08-23 23:33:38 - 📋 Processing branch 46/100: cursor/add-and-advertise-new-services-then-build-9d8e
2025-08-23 23:33:38 - 🔄 Attempting to merge cursor/add-and-advertise-new-services-then-build-9d8e (attempt 1/3)...
2025-08-23 23:33:38 - 🔄 Syncing with remote main branch...
2025-08-23 23:33:39 - ✅ Synced with remote main branch
2025-08-23 23:33:39 - ✅ Successfully merged cursor/add-and-advertise-new-services-then-build-9d8e
2025-08-23 23:33:39 - ✅ Branch cursor/add-and-advertise-new-services-then-build-9d8e processed successfully
2025-08-23 23:33:39 - 📊 Progress: 46 successful, 0 failed, 0 conflicts resolved
2025-08-23 23:33:39 - ---
2025-08-23 23:33:39 - 📋 Processing branch 47/100: cursor/add-and-advertise-new-services-then-build-a284
2025-08-23 23:33:40 - 🔄 Attempting to merge cursor/add-and-advertise-new-services-then-build-a284 (attempt 1/3)...
2025-08-23 23:33:40 - 🔄 Syncing with remote main branch...
2025-08-23 23:33:40 - ✅ Synced with remote main branch
2025-08-23 23:33:41 - ✅ Successfully merged cursor/add-and-advertise-new-services-then-build-a284
2025-08-23 23:33:41 - ✅ Branch cursor/add-and-advertise-new-services-then-build-a284 processed successfully
2025-08-23 23:33:41 - 📊 Progress: 47 successful, 0 failed, 0 conflicts resolved
2025-08-23 23:33:41 - ---
2025-08-23 23:33:41 - 📋 Processing branch 48/100: cursor/add-and-advertise-new-services-then-build-a421
2025-08-23 23:33:41 - 🔄 Attempting to merge cursor/add-and-advertise-new-services-then-build-a421 (attempt 1/3)...
2025-08-23 23:33:41 - 🔄 Syncing with remote main branch...
2025-08-23 23:33:42 - ✅ Synced with remote main branch
2025-08-23 23:33:42 - ✅ Successfully merged cursor/add-and-advertise-new-services-then-build-a421
2025-08-23 23:33:43 - ✅ Branch cursor/add-and-advertise-new-services-then-build-a421 processed successfully
2025-08-23 23:33:43 - 📊 Progress: 48 successful, 0 failed, 0 conflicts resolved
2025-08-23 23:33:43 - ---
2025-08-23 23:33:43 - 📋 Processing branch 49/100: cursor/add-and-advertise-new-services-then-build-a930
2025-08-23 23:33:43 - 🔄 Attempting to merge cursor/add-and-advertise-new-services-then-build-a930 (attempt 1/3)...
2025-08-23 23:33:43 - 🔄 Syncing with remote main branch...
2025-08-23 23:33:44 - ✅ Synced with remote main branch
2025-08-23 23:33:44 - ✅ Successfully merged cursor/add-and-advertise-new-services-then-build-a930
2025-08-23 23:33:44 - ✅ Branch cursor/add-and-advertise-new-services-then-build-a930 processed successfully
2025-08-23 23:33:44 - 📊 Progress: 49 successful, 0 failed, 0 conflicts resolved
2025-08-23 23:33:44 - ---
2025-08-23 23:33:44 - 📋 Processing branch 50/100: cursor/add-and-advertise-new-services-then-build-a975
2025-08-23 23:33:45 - 🔄 Attempting to merge cursor/add-and-advertise-new-services-then-build-a975 (attempt 1/3)...
2025-08-23 23:33:45 - 🔄 Syncing with remote main branch...
2025-08-23 23:33:45 - ✅ Synced with remote main branch
2025-08-23 23:33:46 - ✅ Successfully merged cursor/add-and-advertise-new-services-then-build-a975
2025-08-23 23:33:46 - ✅ Branch cursor/add-and-advertise-new-services-then-build-a975 processed successfully
2025-08-23 23:33:46 - 📊 Progress: 50 successful, 0 failed, 0 conflicts resolved
2025-08-23 23:33:46 - ---
2025-08-23 23:33:46 - 💾 Pushing intermediate changes to remote...
2025-08-23 23:33:46 - ✅ Successfully pushed changes to remote
2025-08-23 23:33:46 - 📋 Processing branch 51/100: cursor/add-and-advertise-new-services-then-build-ab61
2025-08-23 23:33:47 - 🔄 Attempting to merge cursor/add-and-advertise-new-services-then-build-ab61 (attempt 1/3)...
2025-08-23 23:33:47 - 🔄 Syncing with remote main branch...
2025-08-23 23:33:47 - ✅ Synced with remote main branch
2025-08-23 23:33:48 - ✅ Successfully merged cursor/add-and-advertise-new-services-then-build-ab61
2025-08-23 23:33:48 - ✅ Branch cursor/add-and-advertise-new-services-then-build-ab61 processed successfully
2025-08-23 23:33:48 - 📊 Progress: 51 successful, 0 failed, 0 conflicts resolved
2025-08-23 23:33:48 - ---
2025-08-23 23:33:48 - 📋 Processing branch 52/100: cursor/add-and-advertise-new-services-then-build-b17c
2025-08-23 23:33:48 - 🔄 Attempting to merge cursor/add-and-advertise-new-services-then-build-b17c (attempt 1/3)...
2025-08-23 23:33:48 - 🔄 Syncing with remote main branch...
2025-08-23 23:33:49 - ✅ Synced with remote main branch
2025-08-23 23:33:50 - ✅ Successfully merged cursor/add-and-advertise-new-services-then-build-b17c
2025-08-23 23:33:50 - ✅ Branch cursor/add-and-advertise-new-services-then-build-b17c processed successfully
2025-08-23 23:33:50 - 📊 Progress: 52 successful, 0 failed, 0 conflicts resolved
2025-08-23 23:33:50 - ---
2025-08-23 23:33:50 - 📋 Processing branch 53/100: cursor/add-and-advertise-new-services-then-build-b3c7
2025-08-23 23:33:50 - 🔄 Attempting to merge cursor/add-and-advertise-new-services-then-build-b3c7 (attempt 1/3)...
2025-08-23 23:33:50 - 🔄 Syncing with remote main branch...
2025-08-23 23:33:51 - ✅ Synced with remote main branch
2025-08-23 23:33:51 - ✅ Successfully merged cursor/add-and-advertise-new-services-then-build-b3c7
2025-08-23 23:33:52 - ✅ Branch cursor/add-and-advertise-new-services-then-build-b3c7 processed successfully
2025-08-23 23:33:52 - 📊 Progress: 53 successful, 0 failed, 0 conflicts resolved
2025-08-23 23:33:52 - ---
2025-08-23 23:33:52 - 📋 Processing branch 54/100: cursor/add-and-advertise-new-services-then-build-b766
2025-08-23 23:33:52 - 🔄 Attempting to merge cursor/add-and-advertise-new-services-then-build-b766 (attempt 1/3)...
2025-08-23 23:33:52 - 🔄 Syncing with remote main branch...
2025-08-23 23:33:53 - ✅ Synced with remote main branch
2025-08-23 23:33:53 - ✅ Successfully merged cursor/add-and-advertise-new-services-then-build-b766
2025-08-23 23:33:53 - ✅ Branch cursor/add-and-advertise-new-services-then-build-b766 processed successfully
2025-08-23 23:33:53 - 📊 Progress: 54 successful, 0 failed, 0 conflicts resolved
2025-08-23 23:33:53 - ---
2025-08-23 23:33:53 - 📋 Processing branch 55/100: cursor/add-and-advertise-new-services-then-build-b89c
2025-08-23 23:33:54 - 🔄 Attempting to merge cursor/add-and-advertise-new-services-then-build-b89c (attempt 1/3)...
2025-08-23 23:33:54 - 🔄 Syncing with remote main branch...
2025-08-23 23:33:54 - ✅ Synced with remote main branch
2025-08-23 23:33:55 - ✅ Successfully merged cursor/add-and-advertise-new-services-then-build-b89c
2025-08-23 23:33:55 - ✅ Branch cursor/add-and-advertise-new-services-then-build-b89c processed successfully
2025-08-23 23:33:55 - 📊 Progress: 55 successful, 0 failed, 0 conflicts resolved
2025-08-23 23:33:55 - ---
2025-08-23 23:33:55 - 📋 Processing branch 56/100: cursor/add-and-advertise-new-services-then-build-bb33
2025-08-23 23:33:55 - 🔄 Attempting to merge cursor/add-and-advertise-new-services-then-build-bb33 (attempt 1/3)...
2025-08-23 23:33:55 - 🔄 Syncing with remote main branch...
2025-08-23 23:33:56 - ✅ Synced with remote main branch
2025-08-23 23:33:57 - ✅ Successfully merged cursor/add-and-advertise-new-services-then-build-bb33
2025-08-23 23:33:57 - ✅ Branch cursor/add-and-advertise-new-services-then-build-bb33 processed successfully
2025-08-23 23:33:57 - 📊 Progress: 56 successful, 0 failed, 0 conflicts resolved
2025-08-23 23:33:57 - ---
2025-08-23 23:33:57 - 📋 Processing branch 57/100: cursor/add-and-advertise-new-services-then-build-bdcb
2025-08-23 23:33:57 - 🔄 Attempting to merge cursor/add-and-advertise-new-services-then-build-bdcb (attempt 1/3)...
2025-08-23 23:33:57 - 🔄 Syncing with remote main branch...
2025-08-23 23:33:58 - ✅ Synced with remote main branch
2025-08-23 23:33:58 - ✅ Successfully merged cursor/add-and-advertise-new-services-then-build-bdcb
2025-08-23 23:33:58 - ✅ Branch cursor/add-and-advertise-new-services-then-build-bdcb processed successfully
2025-08-23 23:33:58 - 📊 Progress: 57 successful, 0 failed, 0 conflicts resolved
2025-08-23 23:33:58 - ---
2025-08-23 23:33:58 - 📋 Processing branch 58/100: cursor/add-and-advertise-new-services-then-build-c44e
2025-08-23 23:33:59 - 🔄 Attempting to merge cursor/add-and-advertise-new-services-then-build-c44e (attempt 1/3)...
2025-08-23 23:33:59 - 🔄 Syncing with remote main branch...
2025-08-23 23:34:00 - ✅ Synced with remote main branch
2025-08-23 23:34:00 - ✅ Successfully merged cursor/add-and-advertise-new-services-then-build-c44e
2025-08-23 23:34:00 - ✅ Branch cursor/add-and-advertise-new-services-then-build-c44e processed successfully
2025-08-23 23:34:00 - 📊 Progress: 58 successful, 0 failed, 0 conflicts resolved
2025-08-23 23:34:00 - ---
2025-08-23 23:34:00 - 📋 Processing branch 59/100: cursor/add-and-advertise-new-services-then-build-c4de
2025-08-23 23:34:00 - 🔄 Attempting to merge cursor/add-and-advertise-new-services-then-build-c4de (attempt 1/3)...
2025-08-23 23:34:00 - 🔄 Syncing with remote main branch...
2025-08-23 23:34:05 - ✅ Synced with remote main branch
2025-08-23 23:34:06 - ✅ Successfully merged cursor/add-and-advertise-new-services-then-build-c4de
2025-08-23 23:34:06 - ✅ Branch cursor/add-and-advertise-new-services-then-build-c4de processed successfully
2025-08-23 23:34:06 - 📊 Progress: 59 successful, 0 failed, 0 conflicts resolved
2025-08-23 23:34:06 - ---
2025-08-23 23:34:06 - 📋 Processing branch 60/100: cursor/add-and-advertise-new-services-then-build-d192
2025-08-23 23:34:06 - 🔄 Attempting to merge cursor/add-and-advertise-new-services-then-build-d192 (attempt 1/3)...
2025-08-23 23:34:06 - 🔄 Syncing with remote main branch...
2025-08-23 23:34:06 - ✅ Synced with remote main branch
2025-08-23 23:34:07 - ✅ Successfully merged cursor/add-and-advertise-new-services-then-build-d192
2025-08-23 23:34:08 - ✅ Branch cursor/add-and-advertise-new-services-then-build-d192 processed successfully
2025-08-23 23:34:08 - 📊 Progress: 60 successful, 0 failed, 0 conflicts resolved
2025-08-23 23:34:08 - ---
2025-08-23 23:34:08 - 📋 Processing branch 61/100: cursor/add-and-advertise-new-services-then-build-d68c
2025-08-23 23:34:08 - 🔄 Attempting to merge cursor/add-and-advertise-new-services-then-build-d68c (attempt 1/3)...
2025-08-23 23:34:08 - 🔄 Syncing with remote main branch...
2025-08-23 23:34:08 - ✅ Synced with remote main branch
2025-08-23 23:34:09 - ✅ Successfully merged cursor/add-and-advertise-new-services-then-build-d68c
2025-08-23 23:34:09 - ✅ Branch cursor/add-and-advertise-new-services-then-build-d68c processed successfully
2025-08-23 23:34:09 - 📊 Progress: 61 successful, 0 failed, 0 conflicts resolved
2025-08-23 23:34:09 - ---
2025-08-23 23:34:09 - 📋 Processing branch 62/100: cursor/add-and-advertise-new-services-then-build-da38
2025-08-23 23:34:10 - 🔄 Attempting to merge cursor/add-and-advertise-new-services-then-build-da38 (attempt 1/3)...
2025-08-23 23:34:10 - 🔄 Syncing with remote main branch...
2025-08-23 23:34:10 - ✅ Synced with remote main branch
2025-08-23 23:34:11 - ✅ Successfully merged cursor/add-and-advertise-new-services-then-build-da38
2025-08-23 23:34:12 - ✅ Branch cursor/add-and-advertise-new-services-then-build-da38 processed successfully
2025-08-23 23:34:12 - 📊 Progress: 62 successful, 0 failed, 0 conflicts resolved
2025-08-23 23:34:12 - ---
2025-08-23 23:34:12 - 📋 Processing branch 63/100: cursor/add-and-advertise-new-services-then-build-e1f5
2025-08-23 23:34:12 - 🔄 Attempting to merge cursor/add-and-advertise-new-services-then-build-e1f5 (attempt 1/3)...
2025-08-23 23:34:12 - 🔄 Syncing with remote main branch...
2025-08-23 23:34:12 - ✅ Synced with remote main branch
2025-08-23 23:34:13 - ✅ Successfully merged cursor/add-and-advertise-new-services-then-build-e1f5
2025-08-23 23:34:14 - ✅ Branch cursor/add-and-advertise-new-services-then-build-e1f5 processed successfully
2025-08-23 23:34:14 - 📊 Progress: 63 successful, 0 failed, 0 conflicts resolved
2025-08-23 23:34:14 - ---
2025-08-23 23:34:14 - 📋 Processing branch 64/100: cursor/add-and-advertise-new-services-then-build-e6ba
2025-08-23 23:34:14 - 🔄 Attempting to merge cursor/add-and-advertise-new-services-then-build-e6ba (attempt 1/3)...
2025-08-23 23:34:14 - 🔄 Syncing with remote main branch...
2025-08-23 23:34:14 - ✅ Synced with remote main branch
2025-08-23 23:34:15 - ✅ Successfully merged cursor/add-and-advertise-new-services-then-build-e6ba
2025-08-23 23:34:16 - ✅ Branch cursor/add-and-advertise-new-services-then-build-e6ba processed successfully
2025-08-23 23:34:16 - 📊 Progress: 64 successful, 0 failed, 0 conflicts resolved
2025-08-23 23:34:16 - ---
2025-08-23 23:34:16 - 📋 Processing branch 65/100: cursor/add-and-advertise-new-services-then-build-e8d4
2025-08-23 23:34:16 - 🔄 Attempting to merge cursor/add-and-advertise-new-services-then-build-e8d4 (attempt 1/3)...
2025-08-23 23:34:16 - 🔄 Syncing with remote main branch...
2025-08-23 23:34:16 - ✅ Synced with remote main branch
2025-08-23 23:34:17 - ✅ Successfully merged cursor/add-and-advertise-new-services-then-build-e8d4
2025-08-23 23:34:17 - ✅ Branch cursor/add-and-advertise-new-services-then-build-e8d4 processed successfully
2025-08-23 23:34:17 - 📊 Progress: 65 successful, 0 failed, 0 conflicts resolved
2025-08-23 23:34:17 - ---
2025-08-23 23:34:17 - 📋 Processing branch 66/100: cursor/add-and-advertise-new-services-then-build-ea8f
2025-08-23 23:34:18 - 🔄 Attempting to merge cursor/add-and-advertise-new-services-then-build-ea8f (attempt 1/3)...
2025-08-23 23:34:18 - 🔄 Syncing with remote main branch...
2025-08-23 23:34:29 - ✅ Synced with remote main branch
2025-08-23 23:34:29 - ✅ Successfully merged cursor/add-and-advertise-new-services-then-build-ea8f
2025-08-23 23:34:30 - ✅ Branch cursor/add-and-advertise-new-services-then-build-ea8f processed successfully
2025-08-23 23:34:30 - 📊 Progress: 66 successful, 0 failed, 0 conflicts resolved
2025-08-23 23:34:30 - ---
2025-08-23 23:34:30 - 📋 Processing branch 67/100: cursor/add-and-advertise-new-services-then-build-ec85
2025-08-23 23:34:30 - 🔄 Attempting to merge cursor/add-and-advertise-new-services-then-build-ec85 (attempt 1/3)...
2025-08-23 23:34:30 - 🔄 Syncing with remote main branch...
2025-08-23 23:34:31 - ✅ Synced with remote main branch
2025-08-23 23:34:31 - ✅ Successfully merged cursor/add-and-advertise-new-services-then-build-ec85
2025-08-23 23:34:31 - ✅ Branch cursor/add-and-advertise-new-services-then-build-ec85 processed successfully
2025-08-23 23:34:31 - 📊 Progress: 67 successful, 0 failed, 0 conflicts resolved
2025-08-23 23:34:31 - ---
2025-08-23 23:34:31 - 📋 Processing branch 68/100: cursor/add-and-advertise-new-services-then-build-ed33
2025-08-23 23:34:32 - 🔄 Attempting to merge cursor/add-and-advertise-new-services-then-build-ed33 (attempt 1/3)...
2025-08-23 23:34:32 - 🔄 Syncing with remote main branch...
2025-08-23 23:34:32 - ✅ Synced with remote main branch
2025-08-23 23:34:33 - ✅ Successfully merged cursor/add-and-advertise-new-services-then-build-ed33
2025-08-23 23:34:33 - ✅ Branch cursor/add-and-advertise-new-services-then-build-ed33 processed successfully
2025-08-23 23:34:33 - 📊 Progress: 68 successful, 0 failed, 0 conflicts resolved
2025-08-23 23:34:33 - ---
2025-08-23 23:34:33 - 📋 Processing branch 69/100: cursor/add-and-advertise-new-services-then-build-ef5a
2025-08-23 23:34:34 - 🔄 Attempting to merge cursor/add-and-advertise-new-services-then-build-ef5a (attempt 1/3)...
2025-08-23 23:34:34 - 🔄 Syncing with remote main branch...
2025-08-23 23:34:34 - ✅ Synced with remote main branch
2025-08-23 23:34:35 - ✅ Successfully merged cursor/add-and-advertise-new-services-then-build-ef5a
2025-08-23 23:34:35 - ✅ Branch cursor/add-and-advertise-new-services-then-build-ef5a processed successfully
2025-08-23 23:34:35 - 📊 Progress: 69 successful, 0 failed, 0 conflicts resolved
2025-08-23 23:34:35 - ---
2025-08-23 23:34:35 - 📋 Processing branch 70/100: cursor/add-and-advertise-new-services-then-build-f13c
2025-08-23 23:34:35 - 🔄 Attempting to merge cursor/add-and-advertise-new-services-then-build-f13c (attempt 1/3)...
2025-08-23 23:34:35 - 🔄 Syncing with remote main branch...
2025-08-23 23:34:36 - ✅ Synced with remote main branch
2025-08-23 23:34:37 - ✅ Successfully merged cursor/add-and-advertise-new-services-then-build-f13c
2025-08-23 23:34:37 - ✅ Branch cursor/add-and-advertise-new-services-then-build-f13c processed successfully
2025-08-23 23:34:37 - 📊 Progress: 70 successful, 0 failed, 0 conflicts resolved
2025-08-23 23:34:37 - ---
2025-08-23 23:34:37 - 📋 Processing branch 71/100: cursor/add-and-advertise-new-services-then-build-f199
2025-08-23 23:34:37 - 🔄 Attempting to merge cursor/add-and-advertise-new-services-then-build-f199 (attempt 1/3)...
2025-08-23 23:34:37 - 🔄 Syncing with remote main branch...
2025-08-23 23:34:38 - ✅ Synced with remote main branch
2025-08-23 23:34:38 - ✅ Successfully merged cursor/add-and-advertise-new-services-then-build-f199
2025-08-23 23:34:39 - ✅ Branch cursor/add-and-advertise-new-services-then-build-f199 processed successfully
2025-08-23 23:34:39 - 📊 Progress: 71 successful, 0 failed, 0 conflicts resolved
2025-08-23 23:34:39 - ---
2025-08-23 23:34:39 - 📋 Processing branch 72/100: cursor/add-and-advertise-new-services-then-build-f35d
2025-08-23 23:34:39 - 🔄 Attempting to merge cursor/add-and-advertise-new-services-then-build-f35d (attempt 1/3)...
2025-08-23 23:34:39 - 🔄 Syncing with remote main branch...
2025-08-23 23:34:40 - ✅ Synced with remote main branch
2025-08-23 23:34:40 - ✅ Successfully merged cursor/add-and-advertise-new-services-then-build-f35d
2025-08-23 23:34:41 - ✅ Branch cursor/add-and-advertise-new-services-then-build-f35d processed successfully
2025-08-23 23:34:41 - 📊 Progress: 72 successful, 0 failed, 0 conflicts resolved
2025-08-23 23:34:41 - ---
2025-08-23 23:34:41 - 📋 Processing branch 73/100: cursor/add-and-advertise-new-services-then-build-ff3f
2025-08-23 23:34:41 - 🔄 Attempting to merge cursor/add-and-advertise-new-services-then-build-ff3f (attempt 1/3)...
2025-08-23 23:34:41 - 🔄 Syncing with remote main branch...
2025-08-23 23:34:42 - ✅ Synced with remote main branch
2025-08-23 23:34:42 - ✅ Successfully merged cursor/add-and-advertise-new-services-then-build-ff3f
2025-08-23 23:34:43 - ✅ Branch cursor/add-and-advertise-new-services-then-build-ff3f processed successfully
2025-08-23 23:34:43 - 📊 Progress: 73 successful, 0 failed, 0 conflicts resolved
2025-08-23 23:34:43 - ---
2025-08-23 23:34:43 - 📋 Processing branch 74/100: cursor/add-lateral-margins-for-zoom-animation-0c88
2025-08-23 23:34:43 - 🔄 Attempting to merge cursor/add-lateral-margins-for-zoom-animation-0c88 (attempt 1/3)...
2025-08-23 23:34:43 - 🔄 Syncing with remote main branch...
2025-08-23 23:34:44 - ✅ Synced with remote main branch
2025-08-23 23:34:44 - ✅ Successfully merged cursor/add-lateral-margins-for-zoom-animation-0c88
2025-08-23 23:34:45 - ✅ Branch cursor/add-lateral-margins-for-zoom-animation-0c88 processed successfully
2025-08-23 23:34:45 - 📊 Progress: 74 successful, 0 failed, 0 conflicts resolved
2025-08-23 23:34:45 - ---
2025-08-23 23:34:45 - 📋 Processing branch 75/100: cursor/add-more-project-content-0e0b
2025-08-23 23:34:45 - 🔄 Attempting to merge cursor/add-more-project-content-0e0b (attempt 1/3)...
2025-08-23 23:34:45 - 🔄 Syncing with remote main branch...
2025-08-23 23:34:46 - ✅ Synced with remote main branch
2025-08-23 23:34:46 - ✅ Successfully merged cursor/add-more-project-content-0e0b
2025-08-23 23:34:47 - ✅ Branch cursor/add-more-project-content-0e0b processed successfully
2025-08-23 23:34:47 - 📊 Progress: 75 successful, 0 failed, 0 conflicts resolved
2025-08-23 23:34:47 - ---
2025-08-23 23:34:47 - 💾 Pushing intermediate changes to remote...
2025-08-23 23:34:47 - ✅ Successfully pushed changes to remote
2025-08-23 23:34:47 - 📋 Processing branch 76/100: cursor/add-more-project-content-1001
2025-08-23 23:34:48 - 🔄 Attempting to merge cursor/add-more-project-content-1001 (attempt 1/3)...
2025-08-23 23:34:48 - 🔄 Syncing with remote main branch...
2025-08-23 23:34:48 - ✅ Synced with remote main branch
2025-08-23 23:34:49 - ✅ Successfully merged cursor/add-more-project-content-1001
2025-08-23 23:34:49 - ✅ Branch cursor/add-more-project-content-1001 processed successfully
2025-08-23 23:34:49 - 📊 Progress: 76 successful, 0 failed, 0 conflicts resolved
2025-08-23 23:34:49 - ---
2025-08-23 23:34:49 - 📋 Processing branch 77/100: cursor/add-more-project-content-1b70
2025-08-23 23:34:50 - 🔄 Attempting to merge cursor/add-more-project-content-1b70 (attempt 1/3)...
2025-08-23 23:34:50 - 🔄 Syncing with remote main branch...
2025-08-23 23:34:50 - ✅ Synced with remote main branch
2025-08-23 23:34:51 - ✅ Successfully merged cursor/add-more-project-content-1b70
2025-08-23 23:34:51 - ✅ Branch cursor/add-more-project-content-1b70 processed successfully
2025-08-23 23:34:51 - 📊 Progress: 77 successful, 0 failed, 0 conflicts resolved
2025-08-23 23:34:51 - ---
2025-08-23 23:34:51 - 📋 Processing branch 78/100: cursor/add-more-project-content-1e50
2025-08-23 23:34:51 - 🔄 Attempting to merge cursor/add-more-project-content-1e50 (attempt 1/3)...
2025-08-23 23:34:51 - 🔄 Syncing with remote main branch...
2025-08-23 23:34:52 - ✅ Synced with remote main branch
2025-08-23 23:34:53 - ✅ Successfully merged cursor/add-more-project-content-1e50
2025-08-23 23:34:53 - ✅ Branch cursor/add-more-project-content-1e50 processed successfully
2025-08-23 23:34:53 - 📊 Progress: 78 successful, 0 failed, 0 conflicts resolved
2025-08-23 23:34:53 - ---
2025-08-23 23:34:53 - 📋 Processing branch 79/100: cursor/add-more-project-content-2d2a
2025-08-23 23:34:53 - 🔄 Attempting to merge cursor/add-more-project-content-2d2a (attempt 1/3)...
2025-08-23 23:34:53 - 🔄 Syncing with remote main branch...
2025-08-23 23:34:54 - ✅ Synced with remote main branch
2025-08-23 23:34:55 - ✅ Successfully merged cursor/add-more-project-content-2d2a
2025-08-23 23:34:55 - ✅ Branch cursor/add-more-project-content-2d2a processed successfully
2025-08-23 23:34:55 - 📊 Progress: 79 successful, 0 failed, 0 conflicts resolved
2025-08-23 23:34:55 - ---
2025-08-23 23:34:55 - 📋 Processing branch 80/100: cursor/add-more-project-content-3422
2025-08-23 23:34:55 - 🔄 Attempting to merge cursor/add-more-project-content-3422 (attempt 1/3)...
2025-08-23 23:34:55 - 🔄 Syncing with remote main branch...
2025-08-23 23:34:56 - ✅ Synced with remote main branch
2025-08-23 23:34:56 - ✅ Successfully merged cursor/add-more-project-content-3422
2025-08-23 23:34:57 - ✅ Branch cursor/add-more-project-content-3422 processed successfully
2025-08-23 23:34:57 - 📊 Progress: 80 successful, 0 failed, 0 conflicts resolved
2025-08-23 23:34:57 - ---
2025-08-23 23:34:57 - 📋 Processing branch 81/100: cursor/add-more-project-content-343b
2025-08-23 23:34:57 - 🔄 Attempting to merge cursor/add-more-project-content-343b (attempt 1/3)...
2025-08-23 23:34:57 - 🔄 Syncing with remote main branch...
2025-08-23 23:34:58 - ✅ Synced with remote main branch
2025-08-23 23:34:58 - ✅ Successfully merged cursor/add-more-project-content-343b
2025-08-23 23:34:58 - ✅ Branch cursor/add-more-project-content-343b processed successfully
2025-08-23 23:34:58 - 📊 Progress: 81 successful, 0 failed, 0 conflicts resolved
2025-08-23 23:34:58 - ---
2025-08-23 23:34:58 - 📋 Processing branch 82/100: cursor/add-more-project-content-3d4b
2025-08-23 23:34:59 - 🔄 Attempting to merge cursor/add-more-project-content-3d4b (attempt 1/3)...
2025-08-23 23:34:59 - 🔄 Syncing with remote main branch...
2025-08-23 23:34:59 - ✅ Synced with remote main branch
2025-08-23 23:35:00 - ✅ Successfully merged cursor/add-more-project-content-3d4b
2025-08-23 23:35:00 - ✅ Branch cursor/add-more-project-content-3d4b processed successfully
2025-08-23 23:35:00 - 📊 Progress: 82 successful, 0 failed, 0 conflicts resolved
2025-08-23 23:35:00 - ---
2025-08-23 23:35:00 - 📋 Processing branch 83/100: cursor/add-more-project-content-43d6
2025-08-23 23:35:00 - 🔄 Attempting to merge cursor/add-more-project-content-43d6 (attempt 1/3)...
2025-08-23 23:35:00 - 🔄 Syncing with remote main branch...
2025-08-23 23:35:01 - ✅ Synced with remote main branch
2025-08-23 23:35:02 - ✅ Successfully merged cursor/add-more-project-content-43d6
2025-08-23 23:35:02 - ✅ Branch cursor/add-more-project-content-43d6 processed successfully
2025-08-23 23:35:02 - 📊 Progress: 83 successful, 0 failed, 0 conflicts resolved
2025-08-23 23:35:02 - ---
2025-08-23 23:35:02 - 📋 Processing branch 84/100: cursor/add-more-project-content-4ab0
2025-08-23 23:35:02 - 🔄 Attempting to merge cursor/add-more-project-content-4ab0 (attempt 1/3)...
2025-08-23 23:35:02 - 🔄 Syncing with remote main branch...
2025-08-23 23:35:03 - ✅ Synced with remote main branch
2025-08-23 23:35:03 - ✅ Successfully merged cursor/add-more-project-content-4ab0
2025-08-23 23:35:04 - ✅ Branch cursor/add-more-project-content-4ab0 processed successfully
2025-08-23 23:35:04 - 📊 Progress: 84 successful, 0 failed, 0 conflicts resolved
2025-08-23 23:35:04 - ---
2025-08-23 23:35:04 - 📋 Processing branch 85/100: cursor/add-more-project-content-4f94
2025-08-23 23:35:04 - 🔄 Attempting to merge cursor/add-more-project-content-4f94 (attempt 1/3)...
2025-08-23 23:35:04 - 🔄 Syncing with remote main branch...
2025-08-23 23:35:05 - ✅ Synced with remote main branch
2025-08-23 23:35:05 - ✅ Successfully merged cursor/add-more-project-content-4f94
2025-08-23 23:35:06 - ✅ Branch cursor/add-more-project-content-4f94 processed successfully
2025-08-23 23:35:06 - 📊 Progress: 85 successful, 0 failed, 0 conflicts resolved
2025-08-23 23:35:06 - ---
2025-08-23 23:35:06 - 📋 Processing branch 86/100: cursor/add-more-project-content-56da
2025-08-23 23:35:06 - 🔄 Attempting to merge cursor/add-more-project-content-56da (attempt 1/3)...
2025-08-23 23:35:06 - 🔄 Syncing with remote main branch...
2025-08-23 23:35:07 - ✅ Synced with remote main branch
2025-08-23 23:35:07 - ✅ Successfully merged cursor/add-more-project-content-56da
2025-08-23 23:35:08 - ✅ Branch cursor/add-more-project-content-56da processed successfully
2025-08-23 23:35:08 - 📊 Progress: 86 successful, 0 failed, 0 conflicts resolved
2025-08-23 23:35:08 - ---
2025-08-23 23:35:08 - 📋 Processing branch 87/100: cursor/add-more-project-content-5956
2025-08-23 23:35:08 - 🔄 Attempting to merge cursor/add-more-project-content-5956 (attempt 1/3)...
2025-08-23 23:35:08 - 🔄 Syncing with remote main branch...
2025-08-23 23:35:10 - ✅ Synced with remote main branch
2025-08-23 23:35:11 - ✅ Successfully merged cursor/add-more-project-content-5956
2025-08-23 23:35:11 - ✅ Branch cursor/add-more-project-content-5956 processed successfully
2025-08-23 23:35:11 - 📊 Progress: 87 successful, 0 failed, 0 conflicts resolved
2025-08-23 23:35:11 - ---
2025-08-23 23:35:11 - 📋 Processing branch 88/100: cursor/add-more-project-content-5fae
2025-08-23 23:35:11 - 🔄 Attempting to merge cursor/add-more-project-content-5fae (attempt 1/3)...
2025-08-23 23:35:11 - 🔄 Syncing with remote main branch...
2025-08-23 23:35:12 - ✅ Synced with remote main branch
2025-08-23 23:35:12 - ✅ Successfully merged cursor/add-more-project-content-5fae
2025-08-23 23:35:13 - ✅ Branch cursor/add-more-project-content-5fae processed successfully
2025-08-23 23:35:13 - 📊 Progress: 88 successful, 0 failed, 0 conflicts resolved
2025-08-23 23:35:13 - ---
2025-08-23 23:35:13 - 📋 Processing branch 89/100: cursor/add-more-project-content-68ea
2025-08-23 23:35:13 - 🔄 Attempting to merge cursor/add-more-project-content-68ea (attempt 1/3)...
2025-08-23 23:35:13 - 🔄 Syncing with remote main branch...
2025-08-23 23:35:14 - ✅ Synced with remote main branch
2025-08-23 23:35:14 - ✅ Successfully merged cursor/add-more-project-content-68ea
2025-08-23 23:35:15 - ✅ Branch cursor/add-more-project-content-68ea processed successfully
2025-08-23 23:35:15 - 📊 Progress: 89 successful, 0 failed, 0 conflicts resolved
2025-08-23 23:35:15 - ---
2025-08-23 23:35:15 - 📋 Processing branch 90/100: cursor/add-more-project-content-6db1
2025-08-23 23:35:15 - 🔄 Attempting to merge cursor/add-more-project-content-6db1 (attempt 1/3)...
2025-08-23 23:35:15 - 🔄 Syncing with remote main branch...
2025-08-23 23:35:16 - ✅ Synced with remote main branch
2025-08-23 23:35:16 - ✅ Successfully merged cursor/add-more-project-content-6db1
2025-08-23 23:35:16 - ✅ Branch cursor/add-more-project-content-6db1 processed successfully
2025-08-23 23:35:16 - 📊 Progress: 90 successful, 0 failed, 0 conflicts resolved
2025-08-23 23:35:16 - ---
2025-08-23 23:35:16 - 📋 Processing branch 91/100: cursor/add-more-project-content-715e
2025-08-23 23:35:17 - 🔄 Attempting to merge cursor/add-more-project-content-715e (attempt 1/3)...
2025-08-23 23:35:17 - 🔄 Syncing with remote main branch...
2025-08-23 23:35:17 - ✅ Synced with remote main branch
2025-08-23 23:35:18 - ✅ Successfully merged cursor/add-more-project-content-715e
2025-08-23 23:35:18 - ✅ Branch cursor/add-more-project-content-715e processed successfully
2025-08-23 23:35:18 - 📊 Progress: 91 successful, 0 failed, 0 conflicts resolved
2025-08-23 23:35:18 - ---
2025-08-23 23:35:18 - 📋 Processing branch 92/100: cursor/add-more-project-content-783a
2025-08-23 23:35:18 - 🔄 Attempting to merge cursor/add-more-project-content-783a (attempt 1/3)...
2025-08-23 23:35:18 - 🔄 Syncing with remote main branch...
2025-08-23 23:35:19 - ✅ Synced with remote main branch
2025-08-23 23:35:20 - ✅ Successfully merged cursor/add-more-project-content-783a
2025-08-23 23:35:20 - ✅ Branch cursor/add-more-project-content-783a processed successfully
2025-08-23 23:35:20 - 📊 Progress: 92 successful, 0 failed, 0 conflicts resolved
2025-08-23 23:35:20 - ---
2025-08-23 23:35:20 - 📋 Processing branch 93/100: cursor/add-more-project-content-8277
2025-08-23 23:35:20 - 🔄 Attempting to merge cursor/add-more-project-content-8277 (attempt 1/3)...
2025-08-23 23:35:20 - 🔄 Syncing with remote main branch...
2025-08-23 23:35:21 - ✅ Synced with remote main branch
2025-08-23 23:35:21 - ✅ Successfully merged cursor/add-more-project-content-8277
2025-08-23 23:35:22 - ✅ Branch cursor/add-more-project-content-8277 processed successfully
2025-08-23 23:35:22 - 📊 Progress: 93 successful, 0 failed, 0 conflicts resolved
2025-08-23 23:35:22 - ---
2025-08-23 23:35:22 - 📋 Processing branch 94/100: cursor/add-more-project-content-a286
2025-08-23 23:35:22 - 🔄 Attempting to merge cursor/add-more-project-content-a286 (attempt 1/3)...
2025-08-23 23:35:22 - 🔄 Syncing with remote main branch...
2025-08-23 23:35:23 - ✅ Synced with remote main branch
2025-08-23 23:35:23 - ✅ Successfully merged cursor/add-more-project-content-a286
2025-08-23 23:35:23 - ✅ Branch cursor/add-more-project-content-a286 processed successfully
2025-08-23 23:35:23 - 📊 Progress: 94 successful, 0 failed, 0 conflicts resolved
2025-08-23 23:35:23 - ---
2025-08-23 23:35:23 - 📋 Processing branch 95/100: cursor/add-more-project-content-a592
2025-08-23 23:35:24 - 🔄 Attempting to merge cursor/add-more-project-content-a592 (attempt 1/3)...
2025-08-23 23:35:24 - 🔄 Syncing with remote main branch...
2025-08-23 23:35:25 - ✅ Synced with remote main branch
2025-08-23 23:35:25 - ✅ Successfully merged cursor/add-more-project-content-a592
2025-08-23 23:35:25 - ✅ Branch cursor/add-more-project-content-a592 processed successfully
2025-08-23 23:35:25 - 📊 Progress: 95 successful, 0 failed, 0 conflicts resolved
2025-08-23 23:35:25 - ---
2025-08-23 23:35:25 - 📋 Processing branch 96/100: cursor/add-more-project-content-aa12
2025-08-23 23:35:26 - 🔄 Attempting to merge cursor/add-more-project-content-aa12 (attempt 1/3)...
2025-08-23 23:35:26 - 🔄 Syncing with remote main branch...
2025-08-23 23:35:26 - ✅ Synced with remote main branch
2025-08-23 23:35:27 - ✅ Successfully merged cursor/add-more-project-content-aa12
2025-08-23 23:35:27 - ✅ Branch cursor/add-more-project-content-aa12 processed successfully
2025-08-23 23:35:27 - 📊 Progress: 96 successful, 0 failed, 0 conflicts resolved
2025-08-23 23:35:27 - ---
2025-08-23 23:35:27 - 📋 Processing branch 97/100: cursor/add-more-project-content-decc
2025-08-23 23:35:28 - 🔄 Attempting to merge cursor/add-more-project-content-decc (attempt 1/3)...
2025-08-23 23:35:28 - 🔄 Syncing with remote main branch...
2025-08-23 23:35:28 - ✅ Synced with remote main branch
2025-08-23 23:35:29 - ✅ Successfully merged cursor/add-more-project-content-decc
2025-08-23 23:35:29 - ✅ Branch cursor/add-more-project-content-decc processed successfully
2025-08-23 23:35:29 - 📊 Progress: 97 successful, 0 failed, 0 conflicts resolved
2025-08-23 23:35:29 - ---
2025-08-23 23:35:29 - 📋 Processing branch 98/100: cursor/add-more-project-content-e6bb
2025-08-23 23:35:29 - 🔄 Attempting to merge cursor/add-more-project-content-e6bb (attempt 1/3)...
2025-08-23 23:35:29 - 🔄 Syncing with remote main branch...
2025-08-23 23:35:30 - ✅ Synced with remote main branch
2025-08-23 23:35:30 - ✅ Successfully merged cursor/add-more-project-content-e6bb
2025-08-23 23:35:31 - ✅ Branch cursor/add-more-project-content-e6bb processed successfully
2025-08-23 23:35:31 - 📊 Progress: 98 successful, 0 failed, 0 conflicts resolved
2025-08-23 23:35:31 - ---
2025-08-23 23:35:31 - 📋 Processing branch 99/100: cursor/add-more-project-content-ed00
2025-08-23 23:35:31 - 🔄 Attempting to merge cursor/add-more-project-content-ed00 (attempt 1/3)...
2025-08-23 23:35:31 - 🔄 Syncing with remote main branch...
2025-08-23 23:35:32 - ✅ Synced with remote main branch
2025-08-23 23:35:32 - ✅ Successfully merged cursor/add-more-project-content-ed00
2025-08-23 23:35:32 - ✅ Branch cursor/add-more-project-content-ed00 processed successfully
2025-08-23 23:35:32 - 📊 Progress: 99 successful, 0 failed, 0 conflicts resolved
2025-08-23 23:35:32 - ---
2025-08-23 23:35:32 - 📋 Processing branch 100/100: cursor/add-services-pricing-q4-2029
2025-08-23 23:35:33 - 🔄 Attempting to merge cursor/add-services-pricing-q4-2029 (attempt 1/3)...
2025-08-23 23:35:33 - 🔄 Syncing with remote main branch...
2025-08-23 23:35:33 - ✅ Synced with remote main branch
2025-08-23 23:35:34 - ✅ Successfully merged cursor/add-services-pricing-q4-2029
2025-08-23 23:35:34 - ✅ Branch cursor/add-services-pricing-q4-2029 processed successfully
2025-08-23 23:35:34 - 📊 Progress: 100 successful, 0 failed, 0 conflicts resolved
2025-08-23 23:35:34 - ---
2025-08-23 23:35:34 - 💾 Pushing intermediate changes to remote...
2025-08-23 23:35:35 - ✅ Successfully pushed changes to remote
2025-08-23 23:35:35 - 💾 Pushing final changes to remote...
2025-08-23 23:35:35 - ✅ Successfully pushed final changes to remote
2025-08-23 23:35:35 - 🎉 Robust batch merge of cursor branches completed!
2025-08-23 23:35:35 - 📊 Summary:
2025-08-23 23:35:35 -    ✅ Successful merges: 100
2025-08-23 23:35:35 -    ❌ Failed merges: 0
2025-08-23 23:35:35 -    🔧 Conflicts resolved: 0
2025-08-23 23:35:35 -    ⭐️  Skipped branches: 0
2025-08-23 23:35:35 -    🔒 Backup branch: cursor-merge-robust-backup-20250823-233218
2025-08-23 23:35:35 -     Log file: cursor-merge-robust-log-20250823-233218.txt
2025-08-23 23:35:35 -  Completed at: Sat Aug 23 11:35:35 PM UTC 2025
2025-08-23 23:35:35 - 🧹 Next steps:
2025-08-23 23:35:35 -    1. Review the merged changes: git log --oneline -20
2025-08-23 23:35:35 -    2. Test the application thoroughly
2025-08-23 23:35:35 -    3. Run this script again with next batch if needed
2025-08-23 23:35:35 -    4. Consider increasing BATCH_SIZE for faster processing
